<?xml version="1.0" encoding="UTF-8"?>
<peliculas xmlns:xsi="http://www.w3.org/2001/XMLSchema-instance"
           xsi:noNamespaceSchemaLocation="peliculas.xsd">
    <pelicula>
        <IDPelicula>1</IDPelicula>
        <Titulo>El Origen</Titulo>
        <Sinopsis>Un hombre explora los sueños y la realidad.</Sinopsis>
        <Director>Christopher Nolan</Director>
        <Duracion>148</Duracion>
        <Genero>Ciencia Ficción</Genero>
        <AñoLanzamiento>2010</AñoLanzamiento>
        <Pais>USA</Pais>
    </pelicula>
    <pelicula>
        <IDPelicula>2</IDPelicula>
        <Titulo>Parásitos</Titulo>
        <Sinopsis>Una familia pobre se infiltra en la vida de otra rica.</Sinopsis>
        <Director>Bong Joon-ho</Director>
        <Duracion>132</Duracion>
        <Genero>Thriller</Genero>
        <AñoLanzamiento>2019</AñoLanzamiento>
        <Pais>Corea del Sur</Pais>
    </pelicula>
    <pelicula>
        <IDPelicula>3</IDPelicula>
        <Titulo>Amélie</Titulo>
        <Sinopsis>La vida mágica de una joven en París.</Sinopsis>
        <Director>Jean-Pierre Jeunet</Director>
        <Duracion>122</Duracion>
        <Genero>Comedia Romántica</Genero>
        <AñoLanzamiento>2001</AñoLanzamiento>
        <Pais>Francia</Pais>
    </pelicula>
    <pelicula>
        <IDPelicula>4</IDPelicula>
        <Titulo>La La Land</Titulo>
        <Sinopsis>Historia de amor y música en Los Ángeles.</Sinopsis>
        <Director>Damien Chazelle</Director>
        <Duracion>128</Duracion>
        <Genero>Musical</Genero>
        <AñoLanzamiento>2016</AñoLanzamiento>
        <Pais>USA</Pais>
    </pelicula>
    <pelicula>
        <IDPelicula>5</IDPelicula>
        <Titulo>Roma</Titulo>
        <Sinopsis>Una familia en México en los años 70.</Sinopsis>
        <Director>Alfonso Cuarón</Director>
        <Duracion>135</Duracion>
        <Genero>Drama</Genero>
        <AñoLanzamiento>2018</AñoLanzamiento>
        <Pais>México</Pais>
    </pelicula>
</peliculas>
